<?xml version="1.0" encoding="UTF-8"?>  
<!DOCTYPE robot SYSTEM "robot.dtd">  
<robot xmlns:xsi="http://www.w3.org/2001/XMLSchema-instance" xmlns:xsd="http://www.w3.org/2001/XMLSchema">  
       <pdp canId="1"  
            type="REV"/>  
       <pigeon canId="0"  
               canBusName="rio"
               usage="CENTER_OF_ROTATION"  
               type="pigeon2"  
               rotation="0.0"/>  
  
 <!-- ====================================================  
     Chassis  
     ====================================================  -->  
<!-- -->  
       <chassis  type="SWERVE" 
              wheelDiameter="4.0" 
              wheelBase="22.75"   
              track="22.75" 
              maxVelocity="162.0" 
              maxAngularVelocity="360" 
              maxAcceleration="81" 
              maxAngularAcceleration="24" 
              odometryComplianceCoefficient="1.0" 
              networkTable="ChassisNT" 
              controlFile="chassis.xml"> 
 
        <swervemodule type="RIGHT_BACK" 
                      turn_p="0.1" 
                      turn_i="0.0025" 
                      turn_d="0.0" 
                      turn_f="0.0" 
                      turn_nominal_val="0.0" 
                      turn_peak_val="0.9" 
                      turn_max_acc="20" 
                      turn_cruise_vel="50"
                      countsOnTurnEncoderPerDegreesOnAngleSensor="-120.9325"> 
            <motor  usage="SWERVE_DRIVE" 
                    canId="17" 
                    pdpID="17" 
                    type="FALCON" 
                    inverted="true" 
                    sensorInverted="false" 
                    feedbackDevice="INTERNAL" 
                    countsPerRev="2048" 
                    gearRatio="6.75" 
                    brakeMode="true" 
                    follow="-1" 
                    peakCurrentDuration="25.0" 
                    continuousCurrentLimit="20.0" 
                    peakCurrentLimit="25.0" 
                    currentLimiting="true"  
                    forwardlimitswitch="false" 
                    forwardlimitswitchopen="true" 
                    reverselimitswitch="false" 
                    reverselimitswitchopen="true" 
                    voltageCompensationSaturation="10.0" 
                   voltageCompensationEnable="true"/>                   
             <motor  usage="SWERVE_TURN" 
                    canId="19" 
                    pdpID="19" 
                    type="FALCON" 
                    inverted="false" 
                    sensorInverted="false" 
                    feedbackDevice="INTERNAL" 
                    countsPerRev="2048" 
                    gearRatio="1.0" 
                    brakeMode="true" 
                    follow="-1" 
                    peakCurrentDuration="25.0" 
                    continuousCurrentLimit="20.0" 
                    peakCurrentLimit="25.0" 
                    currentLimiting="true"  
                    forwardlimitswitch="false" 
                    forwardlimitswitchopen="true" 
                    reverselimitswitch="false" 
                    reverselimitswitchopen="true" 
                    voltageCompensationSaturation="10.0" 
                   voltageCompensationEnable="true"/>         
		    <cancoder canId="19" 
                            offset="156.7092"/> 
        </swervemodule> 
			  
        <swervemodule type="LEFT_BACK" 
                      turn_p="0.1" 
                      turn_i="0.0025"  
                      turn_d="0.0" 
                      turn_f="0.0" 
                      turn_nominal_val="0.0" 
                      turn_peak_val="0.9" 
                      turn_max_acc="10" 
                      turn_cruise_vel="50"
                      countsOnTurnEncoderPerDegreesOnAngleSensor="-120.9325"> 
            <motor  usage="SWERVE_DRIVE" 
                    canId="18" 
                    pdpID="18" 
                    type="FALCON" 
                    inverted="false" 
                    sensorInverted="false" 
                    feedbackDevice="INTERNAL"
                    countsPerRev="2048" 
                    gearRatio="6.75" 
                    brakeMode="true" 
                    follow="-1" 
                    peakCurrentDuration="25.0" 
                    continuousCurrentLimit="20.0" 
                    peakCurrentLimit="25.0" 
                    currentLimiting="true"  
                    forwardlimitswitch="false" 
                    forwardlimitswitchopen="true" 
                    reverselimitswitch="false" 
                    reverselimitswitchopen="true" 
                    voltageCompensationSaturation="10.0" 
                   voltageCompensationEnable="true"/>                   
             <motor usage="SWERVE_TURN" 
                    canId="16" 
                    pdpID="16" 
                    type="FALCON" 
                    inverted="false" 
                    sensorInverted="false" 
                    feedbackDevice="INTERNAL" 
                    countsPerRev="2048" 
                    gearRatio="1.0" 
                    brakeMode="true" 
                    follow="-1" 
                    peakCurrentDuration="25.0" 
                    continuousCurrentLimit="20.0" 
                    peakCurrentLimit="25.0" 
                    currentLimiting="true"  
                    forwardlimitswitch="false" 
                    forwardlimitswitchopen="true" 
                    reverselimitswitch="false" 
                    reverselimitswitchopen="true" 
                    voltageCompensationSaturation="10.0" 
                   voltageCompensationEnable="true"/>         
		    <cancoder canId="16" 
                            offset="43.945"/> 
        </swervemodule> 
 
        <swervemodule type="RIGHT_FRONT" 
                      turn_p="0.1" 
                      turn_i="0.0025"  
                      turn_d="0.0" 
                      turn_f="0.0" 
                      turn_nominal_val="0.0" 
                      turn_peak_val="0.9" 
                      turn_max_acc="10" 
                      turn_cruise_vel="50"
                      countsOnTurnEncoderPerDegreesOnAngleSensor="-120.9325"> 
            <motor  usage="SWERVE_DRIVE" 
                    canId="0" 
                    pdpID="0" 
                    type="FALCON" 
                    inverted="true" 
                    sensorInverted="false" 
                    feedbackDevice="INTERNAL" 
                    countsPerRev="2048" 
                    gearRatio="6.75" 
                    brakeMode="true" 
                    follow="-1" 
                    peakCurrentDuration="25.0" 
                    continuousCurrentLimit="20.0" 
                    peakCurrentLimit="25.0" 
                    currentLimiting="true"  
                    forwardlimitswitch="false" 
                    forwardlimitswitchopen="true" 
                    reverselimitswitch="false" 
                    reverselimitswitchopen="true" 
                    voltageCompensationSaturation="10.0" 
                   voltageCompensationEnable="true"/>                   
             <motor  usage="SWERVE_TURN" 
                    canId="2" 
                    pdpID="2" 
                    type="FALCON" 
                    inverted="false" 
                    sensorInverted="false" 
                    feedbackDevice="INTERNAL" 
                    countsPerRev="2048" 
                    gearRatio="6.75" 
                    brakeMode="true" 
                    follow="-1" 
                    peakCurrentDuration="25.0" 
                    continuousCurrentLimit="20.0" 
                    peakCurrentLimit="25.0" 
                    currentLimiting="true"  
                    forwardlimitswitch="false" 
                    forwardlimitswitchopen="true" 
                    reverselimitswitch="false" 
                    reverselimitswitchopen="true" 
                    voltageCompensationSaturation="10.0" 
                   voltageCompensationEnable="true"/>         
		    <cancoder canId="2" 
                            offset="-51.5923"/> 
        </swervemodule> 
        <swervemodule type="LEFT_FRONT" 
                      turn_p="0.1" 
                      turn_i="0.0025"  
                      turn_d="0.0" 
                      turn_f="0.0" 
                      turn_nominal_val="0.0" 
                      turn_peak_val="0.9" 
                      turn_max_acc="10" 
                      turn_cruise_vel="50"
                      countsOnTurnEncoderPerDegreesOnAngleSensor="-120.9325"> 
            <motor  usage="SWERVE_DRIVE" 
                    canId="1" 
                    pdpID="1" 
                    type="FALCON" 
                    inverted="false" 
                    sensorInverted="false" 
                    feedbackDevice="INTERNAL" 
                    countsPerRev="2048" 
                    gearRatio="6.75" 
                    brakeMode="true" 
                    follow="-1" 
                    peakCurrentDuration="25.0" 
                    continuousCurrentLimit="20.0" 
                    peakCurrentLimit="25.0" 
                    currentLimiting="true"  
                    forwardlimitswitch="false" 
                    forwardlimitswitchopen="true" 
                    reverselimitswitch="false" 
                    reverselimitswitchopen="true" 
                    voltageCompensationSaturation="10.0" 
                   voltageCompensationEnable="true"/>                   
             <motor usage="SWERVE_TURN" 
                    canId="3" 
                    pdpID="3" 
                    type="FALCON" 
                    inverted="false" 
                    sensorInverted="false" 
                    feedbackDevice="INTERNAL" 
                    countsPerRev="2048" 
                    gearRatio="21.429" 
                    brakeMode="true" 
                    follow="-1"